{"$schema":"https://json-schema.org/draft/2020-12/schema","type":"object","additionalProperties":false,"required":["schema_version","order_id","hypothesis_id","report_mode","decision","evidence_tier","edge_claim","weekly_observations","closed_world_observations_sha256","synthetic_expected_classification","validation_seal"],"properties":{"schema_version":{"const":"lily_l3_corrected_rerun_report_v8"},"order_id":{"const":"B7.12"},"hypothesis_id":{"const":"L-3"},"report_mode":{"const":"synthetic_evaluation"},"decision":{"const":"not_run"},"evidence_tier":{"const":"E0"},"edge_claim":{"const":"none"},"weekly_observations":{"type":"array","maxItems":465},"closed_world_observations_sha256":{"type":"string"},"synthetic_expected_classification":{"enum":["non_authoritative_synthetic_only",null]},"validation_seal":{"const":{"status":"sealed_not_accessed","accessed":false}}}}
