{"schema_version":"lily_l3_corrected_rerun_report_v8","order_id":"B7.12","hypothesis_id":"L-3","report_mode":"synthetic_evaluation","decision":"not_run","evidence_tier":"E0","edge_claim":"none","weekly_observations":[{"observation_index":1,"observation_id":"synthetic-week-001","regime":"low","primary_candidate_hhi":0.4,"primary_comparator_hhi":0.47100000000000003,"realized_candidate_hhi":0.4,"realized_comparator_hhi":0.47100000000000003,"side_effects":{"candidate":{"turnover":6,"commission":0.12,"spread_slippage":0.12,"sell_surcharge":0.12,"cap_event":false,"cash_event":false,"scale_down_event":false},"comparator":{"turnover":5,"commission":0.1,"spread_slippage":0.1,"sell_surcharge":0.1,"cap_event":false,"cash_event":false,"scale_down_event":false}}},{"observation_index":2,"observation_id":"synthetic-week-002","regime":"low","primary_candidate_hhi":0.41000000000000003,"primary_comparator_hhi":0.48200000000000004,"realized_candidate_hhi":0.41000000000000003,"realized_comparator_hhi":0.48200000000000004,"side_effects":{"candidate":{"turnover":6,"commission":0.12,"spread_slippage":0.12,"sell_surcharge":0.12,"cap_event":false,"cash_event":false,"scale_down_event":false},"comparator":{"turnover":5,"commission":0.1,"spread_slippage":0.1,"sell_surcharge":0.1,"cap_event":false,"cash_event":false,"scale_down_event":false}}},{"observation_index":3,"observation_id":"synthetic-week-003","regime":"low","primary_candidate_hhi":0.42000000000000004,"primary_comparator_hhi":0.49300000000000005,"realized_candidate_hhi":0.42000000000000004,"realized_comparator_hhi":0.49300000000000005,"side_effects":{"candidate":{"turnover":6,"commission":0.12,"spread_slippage":0.12,"sell_surcharge":0.12,"cap_event":false,"cash_event":false,"scale_down_event":false},"comparator":{"turnover":5,"commission":0.1,"spread_slippage":0.1,"sell_surcharge":0.1,"cap_event":false,"cash_event":false,"scale_down_event":false}}},{"observation_index":4,"observation_id":"synthetic-week-004","regime":"low","primary_candidate_hhi":0.43000000000000005,"primary_comparator_hhi":0.504,"realized_candidate_hhi":0.43000000000000005,"realized_comparator_hhi":0.504,"side_effects":{"candidate":{"turnover":6,"commission":0.12,"spread_slippage":0.12,"sell_surcharge":0.12,"cap_event":false,"cash_event":false,"scale_down_event":false},"comparator":{"turnover":5,"commission":0.1,"spread_slippage":0.1,"sell_surcharge":0.1,"cap_event":false,"cash_event":false,"scale_down_event":false}}},{"observation_index":5,"observation_id":"synthetic-week-005","regime":"low","primary_candidate_hhi":0.4,"primary_comparator_hhi":0.47500000000000003,"realized_candidate_hhi":0.4,"realized_comparator_hhi":0.47500000000000003,"side_effects":{"candidate":{"turnover":6,"commission":0.12,"spread_slippage":0.12,"sell_surcharge":0.12,"cap_event":false,"cash_event":false,"scale_down_event":false},"comparator":{"turnover":5,"commission":0.1,"spread_slippage":0.1,"sell_surcharge":0.1,"cap_event":false,"cash_event":false,"scale_down_event":false}}},{"observation_index":6,"observation_id":"synthetic-week-006","regime":"low","primary_candidate_hhi":0.41000000000000003,"primary_comparator_hhi":0.48600000000000004,"realized_candidate_hhi":0.41000000000000003,"realized_comparator_hhi":0.48600000000000004,"side_effects":{"candidate":{"turnover":6,"commission":0.12,"spread_slippage":0.12,"sell_surcharge":0.12,"cap_event":false,"cash_event":false,"scale_down_event":false},"comparator":{"turnover":5,"commission":0.1,"spread_slippage":0.1,"sell_surcharge":0.1,"cap_event":false,"cash_event":false,"scale_down_event":false}}},{"observation_index":7,"observation_id":"synthetic-week-007","regime":"low","primary_candidate_hhi":0.42000000000000004,"primary_comparator_hhi":0.49700000000000005,"realized_candidate_hhi":0.42000000000000004,"realized_comparator_hhi":0.49700000000000005,"side_effects":{"candidate":{"turnover":6,"commission":0.12,"spread_slippage":0.12,"sell_surcharge":0.12,"cap_event":false,"cash_event":false,"scale_down_event":false},"comparator":{"turnover":5,"commission":0.1,"spread_slippage":0.1,"sell_surcharge":0.1,"cap_event":false,"cash_event":false,"scale_down_event":false}}},{"observation_index":8,"observation_id":"synthetic-week-008","regime":"low","primary_candidate_hhi":0.43000000000000005,"primary_comparator_hhi":0.508,"realized_candidate_hhi":0.43000000000000005,"realized_comparator_hhi":0.508,"side_effects":{"candidate":{"turnover":6,"commission":0.12,"spread_slippage":0.12,"sell_surcharge":0.12,"cap_event":false,"cash_event":false,"scale_down_event":false},"comparator":{"turnover":5,"commission":0.1,"spread_slippage":0.1,"sell_surcharge":0.1,"cap_event":false,"cash_event":false,"scale_down_event":false}}},{"observation_index":9,"observation_id":"synthetic-week-009","regime":"low","primary_candidate_hhi":0.4,"primary_comparator_hhi":0.47900000000000004,"realized_candidate_hhi":0.4,"realized_comparator_hhi":0.47900000000000004,"side_effects":{"candidate":{"turnover":6,"commission":0.12,"spread_slippage":0.12,"sell_surcharge":0.12,"cap_event":false,"cash_event":false,"scale_down_event":false},"comparator":{"turnover":5,"commission":0.1,"spread_slippage":0.1,"sell_surcharge":0.1,"cap_event":false,"cash_event":false,"scale_down_event":false}}},{"observation_index":10,"observation_id":"synthetic-week-010","regime":"low","primary_candidate_hhi":0.41000000000000003,"primary_comparator_hhi":0.49000000000000005,"realized_candidate_hhi":0.41000000000000003,"realized_comparator_hhi":0.49000000000000005,"side_effects":{"candidate":{"turnover":6,"commission":0.12,"spread_slippage":0.12,"sell_surcharge":0.12,"cap_event":false,"cash_event":false,"scale_down_event":false},"comparator":{"turnover":5,"commission":0.1,"spread_slippage":0.1,"sell_surcharge":0.1,"cap_event":false,"cash_event":false,"scale_down_event":false}}},{"observation_index":11,"observation_id":"synthetic-week-011","regime":"low","primary_candidate_hhi":0.42000000000000004,"primary_comparator_hhi":0.501,"realized_candidate_hhi":0.42000000000000004,"realized_comparator_hhi":0.501,"side_effects":{"candidate":{"turnover":6,"commission":0.12,"spread_slippage":0.12,"sell_surcharge":0.12,"cap_event":false,"cash_event":false,"scale_down_event":false},"comparator":{"turnover":5,"commission":0.1,"spread_slippage":0.1,"sell_surcharge":0.1,"cap_event":false,"cash_event":false,"scale_down_event":false}}},{"observation_index":12,"observation_id":"synthetic-week-012","regime":"low","primary_candidate_hhi":0.43000000000000005,"primary_comparator_hhi":0.512,"realized_candidate_hhi":0.43000000000000005,"realized_comparator_hhi":0.512,"side_effects":{"candidate":{"turnover":6,"commission":0.12,"spread_slippage":0.12,"sell_surcharge":0.12,"cap_event":false,"cash_event":false,"scale_down_event":false},"comparator":{"turnover":5,"commission":0.1,"spread_slippage":0.1,"sell_surcharge":0.1,"cap_event":false,"cash_event":false,"scale_down_event":false}}},{"observation_index":13,"observation_id":"synthetic-week-013","regime":"low","primary_candidate_hhi":0.4,"primary_comparator_hhi":0.48300000000000004,"realized_candidate_hhi":0.4,"realized_comparator_hhi":0.48300000000000004,"side_effects":{"candidate":{"turnover":6,"commission":0.12,"spread_slippage":0.12,"sell_surcharge":0.12,"cap_event":false,"cash_event":false,"scale_down_event":false},"comparator":{"turnover":5,"commission":0.1,"spread_slippage":0.1,"sell_surcharge":0.1,"cap_event":false,"cash_event":false,"scale_down_event":false}}},{"observation_index":14,"observation_id":"synthetic-week-014","regime":"low","primary_candidate_hhi":0.41000000000000003,"primary_comparator_hhi":0.49400000000000005,"realized_candidate_hhi":0.41000000000000003,"realized_comparator_hhi":0.49400000000000005,"side_effects":{"candidate":{"turnover":6,"commission":0.12,"spread_slippage":0.12,"sell_surcharge":0.12,"cap_event":false,"cash_event":false,"scale_down_event":false},"comparator":{"turnover":5,"commission":0.1,"spread_slippage":0.1,"sell_surcharge":0.1,"cap_event":false,"cash_event":false,"scale_down_event":false}}},{"observation_index":15,"observation_id":"synthetic-week-015","regime":"low","primary_candidate_hhi":0.42000000000000004,"primary_comparator_hhi":0.505,"realized_candidate_hhi":0.42000000000000004,"realized_comparator_hhi":0.505,"side_effects":{"candidate":{"turnover":6,"commission":0.12,"spread_slippage":0.12,"sell_surcharge":0.12,"cap_event":false,"cash_event":false,"scale_down_event":false},"comparator":{"turnover":5,"commission":0.1,"spread_slippage":0.1,"sell_surcharge":0.1,"cap_event":false,"cash_event":false,"scale_down_event":false}}},{"observation_index":16,"observation_id":"synthetic-week-016","regime":"low","primary_candidate_hhi":0.43000000000000005,"primary_comparator_hhi":0.516,"realized_candidate_hhi":0.43000000000000005,"realized_comparator_hhi":0.516,"side_effects":{"candidate":{"turnover":6,"commission":0.12,"spread_slippage":0.12,"sell_surcharge":0.12,"cap_event":false,"cash_event":false,"scale_down_event":false},"comparator":{"turnover":5,"commission":0.1,"spread_slippage":0.1,"sell_surcharge":0.1,"cap_event":false,"cash_event":false,"scale_down_event":false}}},{"observation_index":17,"observation_id":"synthetic-week-017","regime":"low","primary_candidate_hhi":0.4,"primary_comparator_hhi":0.48700000000000004,"realized_candidate_hhi":0.4,"realized_comparator_hhi":0.48700000000000004,"side_effects":{"candidate":{"turnover":6,"commission":0.12,"spread_slippage":0.12,"sell_surcharge":0.12,"cap_event":false,"cash_event":false,"scale_down_event":false},"comparator":{"turnover":5,"commission":0.1,"spread_slippage":0.1,"sell_surcharge":0.1,"cap_event":false,"cash_event":false,"scale_down_event":false}}},{"observation_index":18,"observation_id":"synthetic-week-018","regime":"low","primary_candidate_hhi":0.41000000000000003,"primary_comparator_hhi":0.49800000000000005,"realized_candidate_hhi":0.41000000000000003,"realized_comparator_hhi":0.49800000000000005,"side_effects":{"candidate":{"turnover":6,"commission"